[
  {
    "name": "Allied Leisure Industries, Incorporated",
    "manufacturer_slug": "allied-leisure",
    "year_start": 1972,
    "year_end": 1979
  },
  {
    "name": "Alvin G. and Company",
    "manufacturer_slug": "alvin-g",
    "year_start": 1991,
    "year_end": 1994
  },
  {
    "name": "American Pinball Inc.",
    "manufacturer_slug": "american-pinball",
    "year_start": 2016,
    "year_end": null
  },
  {
    "name": "Arkon Automaten, GmbH",
    "manufacturer_slug": "arkon",
    "year_start": 1980,
    "year_end": 1982
  },
  {
    "name": "Atari, Incorporated",
    "manufacturer_slug": "atari",
    "year_start": 1976,
    "year_end": 1983
  },
  {
    "name": "Bally Manufacturing Corporation",
    "manufacturer_slug": "bally",
    "year_start": 1931,
    "year_end": 1983
  },
  {
    "name": "Bally Midway Manufacturing Company",
    "manufacturer_slug": "bally",
    "year_start": 1983,
    "year_end": 1988
  },
  {
    "name": "Bally Wulff",
    "manufacturer_slug": "bally",
    "year_start": 1986,
    "year_end": 1987
  },
  {
    "name": "Briarwood, A Division Of Brunswick Manufacturing Company",
    "manufacturer_slug": "briarwood",
    "year_start": 1976,
    "year_end": 1980
  },
  {
    "name": "Brunswick Manufacturing Company",
    "manufacturer_slug": "brunswick",
    "year_start": 1932,
    "year_end": 1980
  },
  {
    "name": "Capcom Coin-Op, Incorporated",
    "manufacturer_slug": "capcom",
    "year_start": 1995,
    "year_end": 1996
  },
  {
    "name": "Centro Matic S.A.",
    "manufacturer_slug": "centro-matic",
    "year_start": 1973,
    "year_end": 1978
  },
  {
    "name": "Chicago Coin Machine Manufacturing Company",
    "manufacturer_slug": "chicago-coin",
    "year_start": 1932,
    "year_end": 1977
  },
  {
    "name": "Chicago Coin Machinery Company",
    "manufacturer_slug": "chicago-coin",
    "year_start": 1932,
    "year_end": null
  },
  {
    "name": "Chicago Gaming Company",
    "manufacturer_slug": "chicago-gaming",
    "year_start": 2003,
    "year_end": null
  },
  {
    "name": "Costruzioni Elettroniche Automatiche",
    "manufacturer_slug": "cea",
    "year_start": 1977,
    "year_end": 1979
  },
  {
    "name": "D. Gottlieb & Company",
    "manufacturer_slug": "gottlieb",
    "year_start": 1931,
    "year_end": 1977
  },
  {
    "name": "D. Gottlieb & Company, a Columbia Pictures Industries Company",
    "manufacturer_slug": "gottlieb",
    "year_start": 1977,
    "year_end": 1983
  },
  {
    "name": "Data East Pinball, Incorporated",
    "manufacturer_slug": "data-east",
    "year_start": 1986,
    "year_end": 1994
  },
  {
    "name": "Day One Pinball Manufacturing, Incorporated",
    "manufacturer_slug": "day-one",
    "year_start": 2015,
    "year_end": 2015
  },
  {
    "name": "Dennard-Williams & Dennard",
    "manufacturer_slug": "williams",
    "year_start": 1933,
    "year_end": 1933
  },
  {
    "name": "Dutch Pinball",
    "manufacturer_slug": "dutch-pinball",
    "year_start": 2014,
    "year_end": 2014
  },
  {
    "name": "Exhibit Supply Company",
    "manufacturer_slug": "exhibit",
    "year_start": 1932,
    "year_end": 1957
  },
  {
    "name": "Game Plan, Incorporated",
    "manufacturer_slug": "game-plan",
    "year_start": 1978,
    "year_end": 1985
  },
  {
    "name": "Geiger-Automatenbau GmbH",
    "manufacturer_slug": "geiger",
    "year_start": 1978,
    "year_end": 1992
  },
  {
    "name": "Genco Manufacturing Company",
    "manufacturer_slug": "genco",
    "year_start": 1931,
    "year_end": 1958
  },
  {
    "name": "Grand Products Incorporated",
    "manufacturer_slug": "grand-products",
    "year_start": 1986,
    "year_end": null
  },
  {
    "name": "Haggis Pinball",
    "manufacturer_slug": "haggis",
    "year_start": 2021,
    "year_end": null
  },
  {
    "name": "Homepin Ltd",
    "manufacturer_slug": "homepin",
    "year_start": 2018,
    "year_end": 2018
  },
  {
    "name": "Interflip S. A.",
    "manufacturer_slug": "interflip",
    "year_start": null,
    "year_end": null
  },
  {
    "name": "J. H. Keeney and Company Incorporated",
    "manufacturer_slug": "keeney",
    "year_start": 1934,
    "year_end": 1964
  },
  {
    "name": "Jersey Jack Pinball, Inc. (Lakewood, NJ)",
    "manufacturer_slug": "jersey-jack",
    "year_start": 2013,
    "year_end": 2019
  },
  {
    "name": "Jersey Jack Pinball, Inc. (Elk Grove Village, IL)",
    "manufacturer_slug": "jersey-jack",
    "year_start": 2020,
    "year_end": null
  },
  {
    "name": "Joctronic Juegos Electronicos S.A.",
    "manufacturer_slug": "joctronic",
    "year_start": 1986,
    "year_end": 1987
  },
  {
    "name": "Keeney and Sons",
    "manufacturer_slug": "keeney",
    "year_start": 1931,
    "year_end": 1932
  },
  {
    "name": "L & V Mambelli",
    "manufacturer_slug": "mambelli",
    "year_start": null,
    "year_end": null
  },
  {
    "name": "MM Computer Games",
    "manufacturer_slug": "manilamatic",
    "year_start": null,
    "year_end": null
  },
  {
    "name": "Maquinas Automaticas Computerizadas, S.A.",
    "manufacturer_slug": "mac-sa",
    "year_start": 1986,
    "year_end": 1987
  },
  {
    "name": "Maquinas Recreativas Sociedad Anonima",
    "manufacturer_slug": "maresa",
    "year_start": null,
    "year_end": null
  },
  {
    "name": "Marvel Manufacturing Company",
    "manufacturer_slug": "marvel",
    "year_start": 1944,
    "year_end": 1948
  },
  {
    "name": "Midway Manufacturing Company",
    "manufacturer_slug": "midway",
    "year_start": 1959,
    "year_end": 1978
  },
  {
    "name": "Midway Manufacturing Company, a subsidiary of WMS Industries, Incorporated",
    "manufacturer_slug": "bally",
    "year_start": 1988,
    "year_end": 1999
  },
  {
    "name": "Midway Pattern Company",
    "manufacturer_slug": "midway",
    "year_start": 1932,
    "year_end": null
  },
  {
    "name": "Mr. Game",
    "manufacturer_slug": "mr-game",
    "year_start": 1988,
    "year_end": 1990
  },
  {
    "name": "Multimorphic, Inc.",
    "manufacturer_slug": "multimorphic",
    "year_start": 2017,
    "year_end": null
  },
  {
    "name": "Mylstar Electronics, Incorporated",
    "manufacturer_slug": "gottlieb",
    "year_start": 1983,
    "year_end": 1984
  },
  {
    "name": "NSM Apparatebau KG",
    "manufacturer_slug": "nsm",
    "year_start": null,
    "year_end": null
  },
  {
    "name": "NSM/LÃ¶wen",
    "manufacturer_slug": "nsm",
    "year_start": 1985,
    "year_end": 1985
  },
  {
    "name": "Northwestern Mail Box Company",
    "manufacturer_slug": "stern-electronics",
    "year_start": 1932,
    "year_end": 1933
  },
  {
    "name": "Nuova Bell Games",
    "manufacturer_slug": "bell-games",
    "year_start": 1985,
    "year_end": 1988
  },
  {
    "name": "Playmatic",
    "manufacturer_slug": "playmatic",
    "year_start": 1968,
    "year_end": 1987
  },
  {
    "name": "Premier Technology",
    "manufacturer_slug": "gottlieb",
    "year_start": 1984,
    "year_end": 1996
  },
  {
    "name": "Quetzal Pinball",
    "manufacturer_slug": "quetzal",
    "year_start": 2015,
    "year_end": null
  },
  {
    "name": "Rally a.k.a. Rally Play Company",
    "manufacturer_slug": "rally",
    "year_start": 1961,
    "year_end": 1969
  },
  {
    "name": "Recel S. A.",
    "manufacturer_slug": "recel",
    "year_start": 1974,
    "year_end": 1986
  },
  {
    "name": "Recel S.A.",
    "manufacturer_slug": "recel",
    "year_start": 1974,
    "year_end": 1986
  },
  {
    "name": "Renato Montanari Giochi",
    "manufacturer_slug": "rmg",
    "year_start": null,
    "year_end": null
  },
  {
    "name": "Riot Pinball, LLC",
    "manufacturer_slug": "riot-pinball",
    "year_start": 2015,
    "year_end": 2015
  },
  {
    "name": "Sega Enterprises, Ltd.",
    "manufacturer_slug": "sega",
    "year_start": 1971,
    "year_end": 1979
  },
  {
    "name": "Sega Pinball, Incorporated",
    "manufacturer_slug": "sega",
    "year_start": 1994,
    "year_end": 1999
  },
  {
    "name": "Sega of America",
    "manufacturer_slug": "sega",
    "year_start": null,
    "year_end": null
  },
  {
    "name": "Segasa",
    "manufacturer_slug": "sega",
    "year_start": 1972,
    "year_end": 1986
  },
  {
    "name": "Segasa d.b.a. Sonic",
    "manufacturer_slug": "sega",
    "year_start": null,
    "year_end": null
  },
  {
    "name": "Skillgame d.b.a. Renato Montanari Giochi",
    "manufacturer_slug": "rmg",
    "year_start": null,
    "year_end": null
  },
  {
    "name": "Southwestern Novelty Company",
    "manufacturer_slug": "stern-electronics",
    "year_start": 1933,
    "year_end": 1933
  },
  {
    "name": "Spinball S.A.L.",
    "manufacturer_slug": "spinball",
    "year_start": 1995,
    "year_end": 1996
  },
  {
    "name": "Spooky Pinball LLC",
    "manufacturer_slug": "spooky",
    "year_start": 2014,
    "year_end": null
  },
  {
    "name": "Stern Electronics, Incorporated",
    "manufacturer_slug": "stern-electronics",
    "year_start": 1977,
    "year_end": 1984
  },
  {
    "name": "Stern Pinball, Incorporated",
    "manufacturer_slug": "stern-pinball",
    "year_start": 1999,
    "year_end": null
  },
  {
    "name": "T.H. Bergmann & Company",
    "manufacturer_slug": "th-bergmann",
    "year_start": 1938,
    "year_end": 1968
  },
  {
    "name": "Taito America Corporation",
    "manufacturer_slug": "taito",
    "year_start": null,
    "year_end": null
  },
  {
    "name": "Taito Trading Co., Ltd.",
    "manufacturer_slug": "taito",
    "year_start": null,
    "year_end": null
  },
  {
    "name": "Taito do Brasil, a division of Taito, Japan",
    "manufacturer_slug": "taito",
    "year_start": null,
    "year_end": null
  },
  {
    "name": "Talleres del Llobregat S.A. [Automaticos]",
    "manufacturer_slug": "automaticos",
    "year_start": null,
    "year_end": null
  },
  {
    "name": "Team Pinball",
    "manufacturer_slug": "team-pinball",
    "year_start": 2018,
    "year_end": 2018
  },
  {
    "name": "Tecnoplay",